{
    "data":  {
                 "mbc":  [
                             {
                                 "id":  "C0019",
                                 "objective":  "Data",
                                 "behavior":  "Check String",
                                 "refs":  [
                                              {
                                                  "ref":  "#signature_matches",
                                                  "value":  "1"
                                              }
                                          ]
                             }
                         ],
                 "signature_matches":  [
                                           {
                                               "id":  "1",
                                               "format":  "SIG_FORMAT_CAPA",
                                               "name":  "parse credit card information",
                                               "description":  "collection/credit-card",
                                               "authors":  [
                                                               "@_re_fox"
                                                           ],
                                               "match_data":  [
                                                                  "mnemonic: cmp",
                                                                  "\u0027=\u0027 (Track 2 separator)",
                                                                  "\u0027?\u0027 (Track 1 \u0026 2 end sentinel)"
                                                              ],
                                               "rule_src":  "rule:\n  meta:\n    name: parse credit card information\n    namespace: collection/credit-card\n    authors:\n      - \"@_re_fox\"\n    scopes:\n      static: function\n      dynamic: unsupported  # requires mnemonic features\n    mbc:\n      - Data::Check String [C0019]\n    examples:\n      - 1d8fd13c890060464019c0f07b928b1a:0x402860\n  features:\n    - and:\n      - 3 or more:\n        - instruction:\n          - mnemonic: cmp\n          - number: 0x5E = \u0027^\u0027 (Track 1 separator)\n        - instruction:\n          - mnemonic: cmp\n          - number: 0x3D = \u0027=\u0027 (Track 2 separator)\n        - instruction:\n          - mnemonic: cmp\n          - number: 0x25 = \u0027%\u0027 (Track 1 start sentinel)\n        - instruction:\n          - mnemonic: cmp\n          - number: 0x42 = \u0027B\u0027 (Format code)\n        - instruction:\n          - mnemonic: cmp\n          - number: 0x44 = \u0027D\u0027 (Format code)\n        - instruction:\n          - mnemonic: cmp\n          - number: 0x3F = \u0027?\u0027 (Track 1 \u0026 2 end sentinel)\n        - instruction:\n          - mnemonic: cmp\n          - number: 0x3B = \u0027;\u0027 (Track 2 start sentinel)\n      - not:\n        - description: if a function also compares these non-hex characters it\u0027s most likely NOT parsing CC data\n        - and:\n          - instruction:\n            - mnemonic: cmp\n            - number: 0x6D = \u0027m\u0027\n          - instruction:\n            - mnemonic: cmp\n            - number: 0x6E = \u0027n\u0027\n          - instruction:\n            - mnemonic: cmp\n            - number: 0x6F = \u0027o\u0027\n          - instruction:\n            - mnemonic: cmp\n            - number: 0x70 = \u0027p\u0027\n"
                                           }
                                       ]
             }
}
