{
    "data":  {
                 "signature_matches":  [
                                           {
                                               "id":  "0",
                                               "format":  "SIG_FORMAT_CAPA",
                                               "name":  "compiled to the .NET platform",
                                               "description":  "runtime/dotnet",
                                               "authors":  [
                                                               "william.ballenthin@mandiant.com"
                                                           ],
                                               "rule_src":  "rule:\n  meta:\n    name: compiled to the .NET platform\n    namespace: runtime/dotnet\n    authors:\n      - william.ballenthin@mandiant.com\n    scopes:\n      static: file\n      dynamic: file\n    examples:\n      - b9f5bd514485fb06da39beff051b9fdc\n  features:\n    - or:\n      - format: dotnet\n      - import: mscoree._CorExeMain\n      - import: mscoree._corexemain\n      - import: mscoree._CorDllMain\n      - import: mscoree._cordllmain\n"
                                           },
                                           {
                                               "id":  "2",
                                               "format":  "SIG_FORMAT_CAPA",
                                               "name":  "run as service",
                                               "description":  "host-interaction/service",
                                               "authors":  [
                                                               "moritz.raabe@mandiant.com",
                                                               "michael.hunhoff@mandiant.com"
                                                           ],
                                               "match_data":  [
                                                                  "api: System.ServiceProcess.ServiceBase::Run"
                                                              ],
                                               "rule_src":  "rule:\n  meta:\n    name: run as service\n    namespace: host-interaction/service\n    authors:\n      - moritz.raabe@mandiant.com\n      - michael.hunhoff@mandiant.com\n    scopes:\n      static: file\n      dynamic: file\n    mbc:\n      - Anti-Behavioral Analysis::Conditional Execution::Runs as Service [B0025.007]\n    examples:\n      - Practical Malware Analysis Lab 03-02.dll_\n  features:\n    - or:\n      - export: ServiceMain\n      - function:\n        - or:\n          - api: RegisterServiceCtrlHandler\n          - api: RegisterServiceCtrlHandlerEx\n          - api: StartServiceCtrlDispatcher\n          - api: System.ServiceProcess.ServiceBase::Run\n"
                                           }
                                       ],
                 "mbc":  [
                             {
                                 "id":  "B0025.007",
                                 "objective":  "Anti-Behavioral Analysis",
                                 "behavior":  "Conditional Execution",
                                 "method":  "Runs as Service",
                                 "refs":  [
                                              {
                                                  "ref":  "#signature_matches",
                                                  "value":  "2"
                                              }
                                          ]
                             }
                         ]
             }
}
