{
    "data":  {
                 "mbc":  [
                             {
                                 "objective":  "File System",
                                 "refs":  [
                                              {
                                                  "ref":  "#signature_matches",
                                                  "value":  "write file on Linux"
                                              }
                                          ],
                                 "id":  "C0052",
                                 "behavior":  "Writes File"
                             }
                         ],
                 "signature_matches":  [
                                           {
                                               "format":  "SIG_FORMAT_CAPA",
                                               "rule_src":  "rule:\n  meta:\n    name: contain loop\n    authors:\n      - moritz.raabe@mandiant.com\n    lib: true\n    scopes:\n      static: function\n      dynamic: unsupported  # requires characteristic features\n    examples:\n      - 08AC667C65D36D6542917655571E61C8:0x406EAA\n  features:\n    - or:\n      - characteristic: loop\n      - characteristic: tight loop\n      - characteristic: recursive call\n",
                                               "name":  "contain loop",
                                               "authors":  [
                                                               "moritz.raabe@mandiant.com"
                                                           ]
                                           },
                                           {
                                               "format":  "SIG_FORMAT_CAPA",
                                               "authors":  [
                                                               "joakim@intezer.com"
                                                           ],
                                               "rule_src":  "rule:\n  meta:\n    name: write file on Linux\n    namespace: host-interaction/file-system/write\n    authors:\n      - joakim@intezer.com\n    scopes:\n      static: function\n      dynamic: thread\n    mbc:\n      - File System::Writes File [C0052]\n    examples:\n      - 7351f8a40c5450557b24622417fc478d:0x401E14\n  features:\n    - and:\n      - os: linux\n      - or:\n        - api: fputc\n        - api: fputs\n        - api: putc\n        - api: write\n        - api: fputwc\n        - api: putwc\n        - api: fputws\n        - api: write\n        - api: fwrite\n        - api: putwchar\n      - optional:\n        - match: create or open file\n",
                                               "name":  "write file on Linux",
                                               "description":  "host-interaction/file-system/write"
                                           }
                                       ]
             }
}
